Timestamp,What type of source is this?,Source Name,Source URL ,Title of Advice,Paragraph or Advice Text (Main Content Here),Main Topic Entities,Sub-entities (If multiple other give as comma separated entries),Intervention Suggested (Actionable),Child Age Range (check all applicable),Guidance Style,"What scenario would this be especially useful for? (e.g. tone, cultural fit, edge cases, or special considerations)",Temporal Context (Only add if relevant),Author,"Credentials / Area of Expertise
e.g. Ph.D. in Child Psychology, Licensed Clinical Psychologist"
4/29/2025 23:58:50,Website Article,Nemours KidsHealth,https://kidshealth.org/en/parents/tantrums.html, Offering Choices to Empower Toddlers,"Try to give toddlers some control over little things. Offer minor choices such as ‘Do you want orange juice or apple juice?’ or ‘Do you want to brush your teeth before or after taking a bath?’ This way, you aren’t asking ‘Do you want to brush your teeth now?’ — which of course will be answered ‘no.’ Allow control when it doesn’t really matter.",Discipline & boundaries,Tantrums,Offer toddlers limited choices to give them a sense of control and reduce tantrums.,"2 years old, 3 years old, 4 years old",Authoritarian,This strategy is particularly effective for toddlers asserting independence. It helps in reducing power struggles by allowing them to make simple decisions.,,,
4/30/2025 0:04:35,Website Article,Children’s Hospital of Philadelphia (CHOP),https://www.chop.edu/news/dos-and-donts-feeding-picky-eaters,Persistent Exposure to New Foods,“Don’t give up on a new food! Try over and over again. The reason: Research says it takes eight to 15 times to introduce a new food before your child will accept it. Yet parents typically offer a food three to five times before deciding their child is never going to like it.”,Picky Eating / Eating Habits,"Picky Eating / Eating Habits, Parental Patience, Mealtime Routines",Consistently reintroduce new foods multiple times without pressure to increase acceptance.,"2 years old, 3 years old, 4 years old, 5 years old",Authoritative,"This approach emphasizes the importance of patience and consistency. By repeatedly offering new foods without coercion, children are more likely to accept them over time. It’s crucial to maintain a positive mealtime environment and avoid pressuring the child.",,,
4/30/2025 0:10:48,Expert Q&A / Forum,University of Maryland Parenting Forum,https://www.umaryland.edu/lifelong-learning/parenting/answers/response/?assignid=1&expertid=&queid=97&uuid=59134E80-5056-A164-33243C0D77DD88CE,Encouraging Positive Behavior Through Specific Praise,"“Children respond well to positive reinforcement. When you notice your child engaging in desirable behavior, such as sharing toys or following instructions, provide immediate and specific praise. For example, say, ‘I really appreciate how you shared your blocks with your sister just now.’ This not only reinforces the behavior but also helps the child understand exactly what they did well.”",Communication & speech,"Positive Reinforcement, Behavior Management, Praise Techniques",Use immediate and specific praise to reinforce positive behaviors in children.,Any,Authoritative,This strategy aligns with authoritative parenting by combining warmth and structure. Consistent use of specific praise can enhance children’s self-esteem and promote the repetition of positive behaviors.,,,
4/30/2025 0:13:03,Book,"No-Drama Discipline by Daniel J. Siegel, M.D., and Tina Payne Bryson, Ph.D.",https://drdansiegel.com/book/no-drama-discipline/,Connect Before You Redirect,"“Before addressing a child’s misbehavior, first connect with them emotionally. This approach helps the child feel understood and calms their nervous system, making them more receptive to guidance. For example, saying, ‘I see you’re upset because you can’t have the toy right now,’ acknowledges their feelings and sets the stage for effective redirection.”",Discipline & boundaries,"Communication & speech, Emotional Regulation, Empathy, Behavior Management","Use empathetic connection to address misbehavior, ensuring the child feels heard before providing guidance.",Any,Authoritative,"This strategy emphasizes the importance of emotional attunement in discipline. By connecting first, parents can foster trust and cooperation, leading to more effective behavior management.",,,
4/30/2025 0:15:27,YouTube / Video,Dr. Becky Kennedy,https://www.youtube.com/watch?v=xrd1lRdTtZ8,Repairing After Yelling at Your Child,"“In moments when you’ve raised your voice at your child, it’s crucial to reconnect and repair the relationship. Acknowledge your actions by saying, ‘I’m sorry I yelled; that wasn’t the right way to express my feelings.’ This approach teaches children about accountability and models healthy emotional regulation.”",Discipline & boundaries,"Discipline & boundaries, Emotional Regulation, Apology, Parent-Child Relationship","After a moment of yelling, initiate a sincere apology to your child to mend the relationship and demonstrate emotional responsibility.",Any,Authoritative,"This strategy emphasizes the importance of repairing the parent-child bond after conflicts, fostering trust and teaching children about healthy emotional expression.",,,
4/30/2025 0:22:24,Podcast,Parenting Pep Talk with Bryan Ward,https://www.youtube.com/watch?v=l7r9JzXn_f8,Implementing Positive Reinforcement to Encourage Good Behavior,"“In this episode, Bryan Ward discusses the power of positive reinforcement in shaping children’s behavior. He emphasizes the importance of acknowledging and praising specific positive actions, such as sharing toys or completing homework, to encourage their repetition. For instance, saying ‘I really appreciate how you helped your sister with her homework today’ reinforces the desired behavior and boosts the child’s self-esteem.”",Communication & speech,"Positive Reinforcement, Behavior Management, Praise Techniques",Use specific and timely positive reinforcement to encourage and establish desired behaviors in children.,Any,Authoritative,This approach aligns with authoritative parenting by combining clear expectations with warmth and support. Consistent positive reinforcement helps children understand which behaviors are appreciated and encourages them to continue those actions.,,,
4/30/2025 0:25:48,Website Article,Perfectionism: How to Help Your Child Avoid the Pitfalls,https://www.healthychildren.org/English/ages-stages/young-adult/Pages/What-Fuels-Perfectionism.aspx,Express Unconditional Acceptance to Mitigate Perfectionism,"“Use the best antidote to an unhealthy sense of perfectionism: unconditional acceptance. The most essential ingredient in raising resilient children and teens is the connections you form when you love or accept your children unconditionally and hold them to high but reasonable expectations. High expectations should not focus on grades or performance, but rather effort, integrity, generosity, empathy and other core values.”",Perfectionism,"Self-Worth, Unconditional Acceptance, Core Values, Emotional Regulation","Demonstrate unconditional love and acceptance, emphasizing effort and core values over flawless performance to help children develop resilience against perfectionism.",Any,Authoritative,"This approach aligns with authoritative parenting by combining warmth with reasonable expectations. By focusing on effort and core values rather than perfection, parents can help children build self-esteem and reduce anxiety associated with perfectionist tendencies.",,,
4/30/2025 0:29:03,Book,Letting Go of Perfect: Empower Children to Overcome Perfectionism by Jill L. Adelson and Hope E. Wilson,https://www.amazon.com/Letting-Go-Perfect-Overcoming-Perfectionism/dp/1593633629,Encouraging Healthy Risk-Taking to Combat Perfectionism,"“Children who strive for perfection often avoid tasks where success isn’t guaranteed. To help them, encourage taking on challenges with uncertain outcomes and emphasize the value of effort over flawless results. For instance, praise their willingness to try something new, regardless of the outcome, to build resilience and reduce fear of failure.”",Perfectionism,"Risk-Taking, Resilience, Fear of Failure, Emotional Regulation","Encourage children to engage in activities outside their comfort zones, focusing on the learning experience rather than the end result, to help them develop coping strategies for imperfection.","6 years old, Any",Authoritative,"This approach aligns with authoritative parenting by combining support with clear expectations. By normalizing mistakes and emphasizing growth, parents can help children develop a healthier relationship with achievement.",,,
4/30/2025 0:31:20,Website Article,Quirky Kid Clinic,https://www.childpsychologist.com.au/resources/perfectionism-in-children-top-8-strategies,Encouraging Flexibility to Manage Perfectionism,"“Children who exhibit perfectionistic tendencies often struggle with rigid thinking patterns. Encouraging flexibility by helping them understand that mistakes are part of learning can alleviate the pressure they place on themselves. For instance, when a child makes an error, guide them to see it as a learning opportunity rather than a failure.”",Perfectionism,"Rigid Thinking, Mistake Management, Learning Opportunities","Promote cognitive flexibility by reframing mistakes as valuable learning experiences, reducing the fear associated with imperfection.",Any,Authoritative,"This approach aligns with authoritative parenting by combining support with guidance, helping children develop resilience and a healthier perspective on mistakes.",,,
4/30/2025 0:32:52,Website Article,Motherly,https://www.mother.ly/parenting/managing-perfectionism-8-surprising-tips-for-helping-your-child/,Allowing Imperfect Homework to Foster Growth,"“Letting children submit homework that isn’t perfect can be a powerful lesson. It teaches them that effort and learning are more important than flawlessness. This practice helps them understand that it’s okay to make mistakes and that growth comes from trying, not just succeeding.”",Perfectionism,"Academic Pressure, Homework, Mistake Acceptance, Learning Process","Encourage children to complete and submit assignments without overemphasizing perfection, reinforcing the value of effort and learning over flawless outcomes.","6 years old, Any",Authoritative,"This strategy supports the development of a growth mindset, helping children become more resilient and less fearful of making mistakes.",,,
4/30/2025 0:54:34,Website Article,Sleep Foundation,https://www.sleepfoundation.org/children-and-sleep/bedtime-routine,Establishing a Consistent Bedtime Routine,"A bedtime routine for kids usually consists of three or four activities, for example, having a snack, brushing teeth, putting on pajamas, and reading a book. These should always be done in the same order. To make the routine even more effective, start winding down the household by dimming the lights and turning off screens in the lead-up to bed. Research indicates that children who follow bedtime routines tend to fall asleep more easily, sleep longer, and experience fewer nighttime awakenings. These routines also support cognitive development and emotional regulation.",Sleep,"Discipline & boundaries, Bedtime Routine, Screen Time, Sleep Hygiene","Implement a consistent sequence of calming activities each night before bed, such as a snack, brushing teeth, putting on pajamas, and reading a book, while reducing screen exposure and dimming lights to signal bedtime.","2 years old, 3 years old, 4 years old, 5 years old, 6 years old, Any",Authoritative,"Consistency in bedtime routines helps children understand expectations and signals the body to prepare for sleep, leading to improved sleep quality and easier bedtimes. While maintaining a consistent sequence of calming activities is beneficial, the specific activities can and should be tailored to your child’s preferences and needs. The key is to establish a predictable pattern that signals it’s time to wind down and prepare for sleep.",,,
4/30/2025 0:57:05,Website Article,Child Mind Institute,https://childmind.org/article/how-to-handle-tantrums-and-meltdowns/,Teaching Self-Soothing Techniques to Manage Tantrums,"Parents need to show kids how to self-soothe. Come up with a list of things you can do to calm down and share it with your child. Slow breathing, counting to ten and mindfulness can all help.",Tantrums,"Self-Soothing Techniques, Mindfulness, Breathing Exercises","Collaborate with your child to identify calming strategies, such as deep breathing or counting, and practice these techniques together to help them manage their emotions during tantrums.","2 years old, 3 years old, 4 years old, 5 years old, 6 years old",Authoritative,"By teaching and modeling self-soothing techniques, parents can empower children to handle strong emotions independently, reducing the frequency and intensity of tantrums over time.",,,
4/30/2025 1:01:01,Website Article,HealthyChildren.org (American Academy of Pediatrics),https://www.healthychildren.org/English/ages-stages/toddler/nutrition/Pages/Picky-Eaters.aspx,Managing Picky Eating Through Consistent Mealtime Practices,"Share a meal together as a family as often as you can. This means no media distractions like TV or cell phones at mealtime. Use this time to model healthy eating. Serve one meal for the whole family and resist the urge to make another meal if your child refuses what you’ve served. This only encourages picky eating. Try to include at least one food your child likes with each meal and continue to provide a balanced meal, whether she eats it or not.",Picky Eating / Eating Habits,"Communication & speech, Family Meals, Mealtime Environment, Modeling Behavior","Establish regular family meals without media distractions, serve the same meal to all family members including at least one preferred food for the child, and avoid preparing alternative meals to discourage picky eating behaviors.","2 years old, 3 years old, 4 years old, 5 years old, 6 years old, Any",Authoritative,"Consistent mealtime routines and modeling healthy eating behaviors can help children develop more varied eating habits over time. Patience and persistence are key, as it may take multiple exposures for a child to accept new foods.",,,
4/30/2025 1:03:36,Website Article,Mayo Clinic Health System,https://www.mayoclinichealthsystem.org/hometown-health/speaking-of-health/6-tips-to-reduce-childrens-screen-time,Establishing Screen-Free Zones and Times,"Create phone-free zones in the home. Making family meal areas a phone-free zone is an easy way to start. Put hand-held devices away. During screen-free hours, put devices away or at a charging station in a common area so they’re not attracting your kids’ attention.",Screen Time,"Device-Free Zones, Mealtime Boundaries, Screen-Free Hours","Designate specific areas and times in the home, such as during meals, as screen-free zones. Store devices in a common area during these times to minimize distractions and encourage family interaction.","2 years old, 3 years old, 4 years old, 5 years old, 6 years old, Any",Authoritative,"Implementing screen-free zones and times fosters healthier habits, improves family communication, and reduces dependency on digital devices. Consistency and parental modeling are key to success.",,,
4/30/2025 1:07:20,Website Article,NPR – Interview with Dr. Becky Kennedy,https://www.npr.org/2022/09/21/1124314881/why-you-should-connect-with-your-kid-not-correct-them,Connect Before You Correct: Understanding the Root of Misbehavior,"Rather than using time-outs and consequences to change a child’s behavior, parents should make an effort to understand why their kid is acting out in the first place. To do that, says Kennedy, parents have to assume their child is inherently ‘good inside’ – that they have good intentions and want to do the right thing. This mindset can help parents avoid making assumptions about their child’s character — and focus their attention instead on unpacking the root reasons of the behavior.",Discipline & boundaries,"Connection Before Correction, Understanding Behavior, Empathy","Before implementing disciplinary actions, engage with your child to understand the underlying reasons for their behavior. Approach situations with empathy, assuming positive intent, to address the root causes effectively.","2 years old, 3 years old, 4 years old, 5 years old, 6 years old, Any",Authoritative,"This approach emphasizes the importance of connection and understanding in addressing behavioral issues, fostering a supportive environment that encourages positive development.",,,
4/30/2025 1:16:37,Website Article,Smart Parenting Nigeria,https://smartparenting.ng/bedtime-sleep-routines/,Incorporating Traditional Bedtime Rituals to Foster Cultural Identity,"“In Nigeria, several cultural practices and traditions are incorporated into bedtime rituals. These can include prayers, storytelling, massage using traditional oils, or herbal remedies to promote relaxation. These routines are passed down through generations and are deeply rooted in the Nigerian culture, providing a sense of continuity and identity.”",Cultural Expectations & Tradition,"Sleep, Bedtime Rituals, Cultural Identity, Storytelling, Traditional Practices","Integrate culturally significant bedtime rituals—such as prayers, storytelling, or the use of traditional oils—into your child’s nightly routine to promote relaxation and strengthen their connection to cultural heritage.","2 years old, 3 years old, 4 years old, 5 years old, 6 years old","Adaptive / Culturally Sensitive, Empathic / Supportive, Reflective / Philosophical, Practical / Action-Oriented","This advice is particularly beneficial for families aiming to preserve cultural traditions and instill a strong sense of identity in their children. It supports emotional well-being by providing comfort through familiar practices, especially during transitions or periods of change.",,,
4/30/2025 1:20:39,Website Article,Zero to Three,https://www.zerotothree.org/resource/understanding-the-influence-of-culture-on-caregiving-practices-from-the-inside-out/,Integrating Cultural Practices into Daily Routines for Toddlers,"Talking with families about their cultural practices, traditions, and beliefs provides the message that they are valued. However, just talking with families may not be enough. Teachers need to understand cultural influences on child development and be open to and accepting of different ways of caring and teaching, and thoughtfully explore the many ways to help children and families feel welcome.",Cultural Expectations & Tradition,"Daily Routines, Cultural Practices, Toddler Development, Family Traditions",Engage with families to learn about their cultural practices and thoughtfully incorporate these traditions into toddlers’ daily routines to support their development and sense of belonging.,2 years old,"Adaptive / Culturally Sensitive, Empathic / Supportive, Reflective / Philosophical, Practical / Action-Oriented","This advice emphasizes the importance of cultural sensitivity in caregiving practices for toddlers. By integrating cultural traditions into daily routines, caregivers can foster a supportive environment that respects and values each child’s background, promoting better developmental outcomes.",,,
4/30/2025 6:25:57,Website Article,Military on source,https://www.militaryonesource.mil/parenting/new-parents/tips-for-disciplining-your-child/,tips for disciplining your child,"Children this age learn by exploring and asking questions. They’re developing language and social skills, including sharing. They may want to try simple tasks on their own and will probably learn by trying new things and taking risks. Help your preschooler by adding the following age-appropriate discipline techniques to those above:

Use positive timeouts when your child needs to cool off. Timeouts should be no longer than one minute for each year of your child’s life. Do not give attention, but give your child comfort items to help him or her calm down.
Focus on what your child should do instead of what not to do.
Praise good behavior rather than punish misbehavior. Rewards are fine but not when they become more important to the child than the good behavior.
Establish rules, set clear limits and follow through if rules are broken. Natural and logical consequences are appropriate for breaking your rules.
Discourage tattling. Offer to listen while children talk through their problems and use their own problem-solving skills to work things out instead of having you solve problems for them. Help them develop their own skills in working through dilemmas or disagreements.
",Discipline & boundaries,Discipline & boundaries,"For children aged 2–6, effective discipline focuses on guiding positive behavior through encouragement, clear boundaries, and opportunities for independent problem-solving, rather than punishment.","2 years old, 3 years old, 4 years old, 5 years old, 6 years old","Directive / Structured, Empathic / Supportive",,,,
4/30/2025 6:43:51,Website Article,raisingchildren.net.au,https://raisingchildren.net.au/toddlers/connecting-communicating/communicating/communicating-well-with-children,communicating well with babies and children:tips,"Key points
Communication with children and babies is essential to their relationships and development.
Good communication involves listening and talking in ways that make children feel important and valued.
Communicating well with children helps them develop skills for communicating with others.",Communication & speech,Communication & speech,"To foster strong relationships and support healthy emotional and social development, parents should practice warm, responsive communication with children from birth. This includes setting aside distraction-free time to talk, actively listening with body language and empathy, encouraging emotional expression, modeling respectful conversation, and using simple, age-appropriate language. These everyday interactions help children feel valued, build their confidence, and teach them essential communication and listening skills.","2 years old, 3 years old, 4 years old, 5 years old, 6 years old",Empathic / Supportive,,,,
4/30/2025 6:57:03,Website Article,The Guardian,https://www.theguardian.com/lifeandstyle/2023/may/22/exhausted-disconnected-and-fed-up-what-is-parental-burnout-and-what-can-you-do-about-it,"Exhausted, disconnected and fed up: what is ‘parental burnout’ and what can you do about it?","Self-compassion is essential: Parents often feel like they’re not doing enough, but being kinder to oneself during difficult times leads to better mental health, improved parenting confidence, and stronger relationships with children.

Reframe self-care: Self-care should not be seen as selfish or optional. Instead, it's a necessary parenting skill that enhances emotional regulation and resilience.

Small actions matter: Everyday self-care habits—like breathing deeply, stepping outside, or chatting with a friend—are more sustainable and impactful than occasional indulgences.

Ask for and accept help: Burnout is common and valid. Acknowledging it and seeking support (from professionals, partners, or community resources) is crucial to sustaining parenting capacity and well-being.","self-compassion, seeking help&support",Stress & Burnout,"Self-Compassion	- Notice when you self-criticize, and reframe your inner voice with empathy. - Remind yourself that no parent is perfect—and that’s okay. 2. Prioritize Self-Care	- Schedule small breaks in your day just for you, even 5 minutes. - Redefine self-care as maintenance, not indulgence. 3. Daily Micro-Habits	- Take a few deep breaths during stressful moments. - Step outside for fresh air or light movement. - Text or call a friend for quick emotional check-ins. 4. Seek & Accept Support	- Learn to recognize signs of burnout (irritability, fatigue, disconnection). - Talk to your partner or support network regularly about how you’re feeling. - Reach out to Parentline, Lifeline, or your GP if things feel overwhelming.",Any,"Reflective / Philosophical, normalizing",,,,
