4/30/2025 9:03:54,Book,The Explosive Child by Dr. Ross W. Greene,https://www.amazon.com/Explosive-Child-Understanding-Frustrated-Chronically/dp/0062270451,Collaborative Problem Solving for Aggressive Tantrums,"In The Explosive Child, Dr. Ross W. Greene introduces the Collaborative Problem Solving (CPS) approach to address challenging behaviors, including aggressive tantrums. He emphasizes that children act out when they lack the skills to handle certain demands or expectations. Instead of viewing these behaviors as willful defiance, Greene suggests seeing them as a lack of skill. The CPS model involves three steps: Empathy (gathering information to understand the child’s concern), Define the Problem (sharing the adult’s concern), and Invitation (brainstorming solutions together). This method fosters a partnership between parent and child, reducing the frequency and intensity of outbursts by addressing the underlying issues collaboratively.",Tantrums,"Aggressive Behavior, Collaborative Problem Solving, Emotional Regulation","When your child exhibits aggressive behavior during a tantrum, initiate the CPS approach. Begin by calmly identifying and acknowledging your child’s feelings and concerns. Share your own concerns about the behavior. Then, work together to find mutually acceptable solutions. This collaborative method addresses the root causes of the behavior and teaches problem-solving skills.",Any,"Directive / Structured, Empathic / Supportive, Scientific / Research-based",This approach is particularly effective for children who frequently exhibit explosive behaviors. It requires patience and consistency but can lead to significant improvements in behavior and the parent-child relationship. The CPS model is adaptable across various cultural contexts and emphasizes respect and collaboration.,"Afternoon (e.g., playtime, homework), Evening (e.g., family time, winding down)",Dr. Ross W. Greene,"Clinical Psychologist, Founder of Lives in the Balance, and Expert in Collaborative Problem Solving"
4/30/2025 9:10:04,Podcast,Peaceful Parenting: Dealing with Tantrums ,https://blog.lovevery.com/podcast/peaceful-parenting-dealing-with-tantrums/ ,Responding to Hitting with Connection and Boundaries,"In the podcast episode “Peaceful Parenting: Dealing with Tantrums,” Dr. Laura Markham discusses strategies for handling situations where a toddler hits a parent during a tantrum. She emphasizes the importance of staying calm and not taking the behavior personally. Dr. Markham advises parents to set clear boundaries by gently holding the child’s hands and saying, “I won’t let you hit me,” conveying that while all feelings are acceptable, certain behaviors are not. She highlights the significance of connecting with the child by acknowledging their emotions, such as saying, “You’re feeling very upset right now.” This approach helps the child feel understood and supported, facilitating emotional regulation and reducing aggressive behaviors over time.",Tantrums,"Aggressive Behavior, Emotional Regulation, Parent-Child Connection","When your child attempts to hit during a tantrum, calmly and firmly hold their hands to prevent harm, stating, “I won’t let you hit.” Ensure both your safety and theirs. Once the child begins to calm, acknowledge their emotions by saying, “You’re feeling very upset right now.” After the episode, discuss alternative ways to express anger, like using words or taking deep breaths, reinforcing that while all feelings are valid, certain behaviors are not acceptable.",Any,"Empathic / Supportive, Reflective / Philosophical, Practical / Action-Oriented","The advice from Dr. Laura Markham on managing aggressive tantrums—particularly when a child hits—can be especially useful in scenarios where:

1. Parents Feel Overwhelmed by Physical Aggression

When a child resorts to hitting during a tantrum, it can be both physically painful and emotionally distressing for the parent. Dr. Markham emphasizes the importance of staying calm and setting clear boundaries, such as saying, “I won’t let you hit me,” to address the behavior without escalating the situation.

2. Children Struggle with Emotional Regulation

Some children have difficulty managing their emotions and may express frustration through physical means. The strategies discussed in the podcast, like validating the child’s feelings and providing a safe space for them to express emotions, can help these children learn healthier ways to cope

3. Parents Seek Non-Punitive Discipline Methods

For parents looking to move away from punitive measures and towards more empathetic parenting, Dr. Markham’s approach offers practical tools. By focusing on connection and understanding, parents can guide their children through difficult moments without resorting to punishment.

4. Cultural Emphasis on Emotional Expression

In cultures or families that value open emotional expression and prioritize emotional intelligence, these techniques align well with existing values. They support the development of empathy and self-awareness in children. 

5. Edge Cases Involving Public Tantrums

Handling tantrums in public settings adds another layer of complexity. Dr. Markham discusses strategies for managing public outbursts, emphasizing the importance of focusing on the child’s needs rather than public perception.

In all these scenarios, the key takeaway is the emphasis on connection, understanding, and teaching children to manage their emotions constructively. This approach not only addresses the immediate behavior but also contributes to the child’s long-term emotional development.","Afternoon (e.g., playtime, homework), Evening (e.g., family time, winding down)",Dr. Laura Markham,"Clinical Psychologist, Parenting Coach, Author of Peaceful Parent, Happy Kids"
4/30/2025 9:12:43,Podcast,3 in 30 Takeaways for Moms,https://3in30podcast.com/258-boundaries-with-kids/,Understanding and Implementing Boundaries with Children ,"In episode 258 of the “3 in 30 Takeaways for Moms” podcast, Stacey Collins discusses the nuances of setting boundaries with children. She differentiates between rules and boundaries, emphasizing that while rules are expectations set by parents, boundaries are personal limits that protect one’s well-being. Collins suggests that parents model boundary-setting by expressing their own limits respectfully, teaching children to do the same. She provides practical examples, such as saying, “I need some quiet time right now,” to illustrate how parents can communicate their needs without guilt. This approach fosters mutual respect and helps children understand the importance of personal space and emotional health. ",Discipline & boundaries,"Emotional Regulation, Parent-Child Communication, Respectful Parenting","Parents are encouraged to model boundary-setting by clearly and calmly communicating their own needs and limits. For instance, stating, “I need a few minutes to finish this task, then I can help you,” teaches children to respect others’ time and space. This practice not only sets healthy boundaries but also equips children with the language and understanding to set their own boundaries in the future.",Any,"Adaptive / Culturally Sensitive, Empathic / Supportive, Practical / Action-Oriented","This advice is especially useful for parents who find themselves overstretched or feeling guilty for needing personal space, particularly in cultures where self-sacrifice in parenting is emphasized. It’s also well-suited for gentle or respectful parenting households that value emotional literacy. The strategy works well during transition periods (e.g., post-naptime, end of play) when children often test limits. Modeling boundary-setting helps prevent burnout and teaches children how to assert needs respectfully—an essential skill for both peer relationships and long-term emotional resilience.",,Stacey Collins,Parenting Educator and Host of the “3 in 30 Takeaways for Moms” Podcast 
4/30/2025 9:15:08,Book,How to Talk So Little Kids Will Listen: A Survival Guide to Life with Children Ages 2–7,https://www.simonandsschuster.com/books/How-to-Talk-So-Little-Kids-Will-Listen/Julie-King/The-How-To-Talk-Series/9781501131639 ,Engaging Cooperation Through Choices and Play ,"In How to Talk So Little Kids Will Listen, Faber and King emphasize the importance of engaging children’s cooperation by offering choices and incorporating playfulness into daily routines. Instead of issuing direct commands, they suggest providing limited choices to empower children and reduce resistance. For example, asking, “Would you like to wear the red shirt or the blue shirt today?” gives the child a sense of control while achieving the desired outcome. Additionally, turning tasks into playful activities, like saying, “Can you hop like a bunny to the bathroom?” can make routines more enjoyable and less confrontational.",Communication & speech,"Cooperation, Choice-Making, Playful Engagement ","When facing resistance during daily routines, offer your child a choice between two acceptable options to foster a sense of autonomy. Incorporate playful elements into tasks to make them more engaging. For instance, transform cleanup time into a game by challenging your child to see how quickly they can pick up toys. These strategies can reduce power struggles and encourage cooperation.","2 years old, 3 years old, 4 years old, 5 years old, 6 years old","Playful / Connected, Empathic / Supportive, Practical / Action-Oriented","This approach is particularly effective for parents seeking to reduce daily power struggles and foster a cooperative environment. It aligns well with parenting styles that value child autonomy and positive reinforcement. The strategies are adaptable across various cultural contexts and are especially beneficial during transitional periods, such as getting ready in the morning or preparing for bedtime.","Morning (e.g., waking up, getting ready), Afternoon (e.g., playtime, homework), Evening (e.g., family time, winding down)",Joanna Faber and Julie King,Parenting Educators and Authors
4/30/2025 9:20:52,Book,"Autonomy-Supportive Parenting: Reduce Parental Burnout and Raise Competent, Confident Children",https://www.amazon.com/Autonomy-Supportive-Parenting-Parental-Competent-Confident/dp/1641709766 ,Setting Boundaries to Support Autonomy and Reduce Burnout ,"In Autonomy-Supportive Parenting, Dr. Emily Edlynn emphasizes the importance of setting clear and consistent boundaries to foster children’s independence while reducing parental burnout. She advocates for a parenting approach that balances warmth and structure, allowing children to develop autonomy within safe limits. Dr. Edlynn suggests that parents involve children in the process of establishing rules and consequences, which promotes a sense of ownership and understanding. By explaining the reasons behind boundaries and encouraging problem-solving, parents can help children internalize expectations and develop self-regulation skills. This approach not only supports the child’s growth but also alleviates the constant pressure on parents to control every aspect of their child’s behavior.",Discipline & boundaries,"Stress & Burnout, Self-Regulation, Autonomy","Engage your child in setting household rules by discussing expectations and consequences together. Clearly explain the reasons behind each boundary to ensure understanding. Encourage your child to participate in problem-solving when rules are broken, fostering accountability and self-regulation. This collaborative approach helps children feel respected and invested in the family structure, reducing power struggles and promoting independence.",Any,"Adaptive / Culturally Sensitive, Empathic / Supportive, Practical / Action-Oriented","This approach is particularly beneficial for parents seeking to balance authority with empathy, especially in cultures that value individual autonomy and collaborative family dynamics. It’s effective in scenarios where children resist rigid rules, as it promotes understanding and cooperation. Additionally, it supports parents experiencing burnout by shifting the focus from control to guidance, fostering a more sustainable and positive parenting experience.",,"Ph.D. in Clinical Psychology, specializing in pediatric and adolescent health psychology; practicing therapist; author; parenting columnist for Parents magazine",Parenting Educators and Child Behavior Specialists
4/30/2025 9:22:46,Website Article,Children’s Hospital of Philadelphia (CHOP),https://www.chop.edu/news/dos-and-donts-feeding-picky-eaters,Patience and Persistence: Navigating Picky Eating in Young Children,"Dr. Katherine Dahlsgaard emphasizes that picky eating is a developmentally normal phase for children aged 2 to 4. She advises parents not to blame themselves, as many picky eaters have siblings who eat well, indicating that the behavior is often innate. Parents should avoid giving up on introducing new foods; research suggests it may take 8 to 15 exposures before a child accepts a new food. Ensuring the child comes to the table hungry by spacing snacks and meals appropriately can increase willingness to try new foods. Setting limits around food in a calm, matter-of-fact tone, such as stating, “You need to eat a bit of this in order to have dessert,” can be effective. Establishing consistent mealtime routines and keeping the atmosphere positive helps children associate mealtime with pleasant experiences.  ",Picky Eating / Eating Habits,"Mealtime Routines, Food Exposure, Parental Strategies","Introduce new foods multiple times without pressure, as acceptance may take several exposures. Ensure your child is hungry at mealtimes by limiting snacks and drinks beforehand. Set clear, calm boundaries around food choices and maintain consistent mealtime routines to create a positive eating environment.",Any,"Empathic / Supportive, Scientific / Research-based, Practical / Action-Oriented","This advice is particularly useful for parents dealing with typical picky eating behaviors in toddlers and young children. It is grounded in research and offers practical strategies that can be applied across various cultural contexts. The emphasis on patience, consistency, and creating a positive mealtime environment can help reduce stress for both parents and children during feeding times.
","Mealtime (e.g., breakfast, lunch, dinner)",Dr. Katherine Dahlsgaard ,"Ph.D., ABPP; Clinical Director of the Anxiety Behaviors Clinic and the Picky Eaters Clinic at CHOP’s Department of Child and Adolescent Psychiatry and Behavioral Sciences"
4/30/2025 9:28:18,Expert Q&A / Forum,Gifted Issues Discussion Forum,https://giftedissues.davidsongifted.org/BB/ubbthreads.php/forums/1/1/Parenting_and_Advocacy.html ,Building Effective Advocacy Skills Through Community Engagement,"Engaging with communities like Hestia and the Gifted Issues Discussion Forum provides parents with a platform to share experiences, strategies, and resources related to advocating for their children’s educational needs. Contributors emphasize the importance of understanding one’s child’s unique requirements, being well-informed about educational policies, and communicating effectively with school personnel. By participating in such forums, parents can learn from others’ successes and challenges, enhancing their ability to advocate effectively. ",Advocacy Skills,"Gifted Education, Parent-Teacher Communication, Educational Policy","Join and actively participate in online forums or local parent groups focused on your child’s educational needs. Share your experiences, ask questions, and seek advice to build your knowledge and confidence in advocacy. Utilize the collective wisdom of the community to navigate challenges and develop effective strategies for engaging with educators and policymakers. ",Any,"Adaptive / Culturally Sensitive, Empathic / Supportive, Practical / Action-Oriented","This approach is particularly beneficial for parents navigating the complexities of advocating for gifted children within educational systems. It offers culturally sensitive and practical strategies, fostering a supportive environment where parents can learn from each other’s experiences and collaboratively develop effective advocacy skills.","Afternoon (e.g., playtime, homework)",Various contributors (parents and educators),Parents and educators experienced in advocating for gifted children’s needs
4/30/2025 17:16:03,Book,Positive Discipline in everyday parenting,https://pdel.org/positivedisciplineineverydayparenting/,"How to teach children effectively, while respecting their rights and build long term skills","Using a problem situation to teach children for long term skills by understanding how children think and feel, providing warmth and structure, and identifying long term goals.",Discipline & boundaries,"Tantrums, Picky Eating / Eating Habits, Communication & speech, Discipline & boundaries, Stress & Burnout, Advocacy Skills, Cultural Expectations & Tradition","Providing warmth such as emotional security, unconditional love, verbal and physical affection, respect child's developmental level, sensitivity to the child's needs, empathy with the child's feeling. Also provide structure: preparing them for difficult situations by telling them what to expect and how they can cope, explaining the reasons for rules, discussing the rules with them and hear their point of view, help them find ways to fix their mistakes in a way that helps them to learn, being fair and flexible, control anger.",Any,"Directive / Structured, Empathic / Supportive, Scientific / Research-based, Reflective / Philosophical, Practical / Action-Oriented",every problem with the child can be an opportunity to teach them for long term skills.,,"Joan E Durrant, Phd",Child clinical Psychologist and Professor Emerita of Community Health Sciences 
4/30/2025 17:37:55,Website Article,WebMd,https://www.webmd.com/parenting/how-to-deal-with-your-child-lying,How to deal with your child lying,"Knowing why your child is lying and how to talk to them can help stop this behavior. 
You should not punish or corner your child when they’re caught in a lie. This can lead to more serious lies or resentment. Instead, remain calm and explain to them why lying is wrong. You can also provide them with facts. Then encourage them to tell you the story again but truthfully. 
",Guilt,"Communication & speech, Discipline & boundaries, Guilt, Advocacy Skills","Don’t scold or yell at them when you catch them in a lie. You’ll want to keep communication honest and comfortable between you and your child. The following steps will help you handle your child’s lies:  View lies as skill-building. As your child gets older, they’ll test what they can get away with. This is how they learn consequences.  Respond to lies with facts. Especially when dealing with children under the age of three, let them know that there are facts. Lay out evidence that contradicts their lies.  Help them find a way to deal with certain behaviors. If you catch your child in a lie, let them know that they can tell you the truth.  If they see you lie, they’ll lie. Your child will watch how you respond to things, and if you’re lying, they will think they can too.  Let older children know there are times when small lies can be okay. Then teach them the moral consequences of bigger lies. Let them see how you’ve been caught in lies and let it be a learning experience for them. ",Any,"Directive / Structured, Empathic / Supportive, Reflective / Philosophical, Practical / Action-Oriented","all children are proned to lie, and must be corrected. ",," Dan Brennan, MD, WebMd editorial contributor",board certified pediatrician and lactation counselor
4/30/2025 18:15:46,Book,The whole brain child,https://drdansiegel.com/book/the-whole-brain-child/,12 revolutionaries strategies to nurture child's developing brain,"What should parents do when children show tantrum, meltdown and aggravation? This book explains the new science of how a child’s brain is wired and how it matures. The “upstairs brain,” which makes decisions and balances emotions, is under construction until the mid-twenties. And especially in young children, the right brain and its emotions tend to rule over the logic of the left brain. No wonder kids can seem-and feel-so out of control. By applying these discoveries to everyday parenting, you can turn any outburst, argument, or fear into a chance to integrate your child’s brain and foster vital growth. Raise calmer, happier children.",Tantrums,"Tantrums, Communication & speech","Name It to Tame It: Corral raging right-brain behavior through left-brain storytelling, appealing to the left brain’s affinity for words and reasoning to calm emotional storms and bodily tension. Engage, Don’t Enrage: Keep your child thinking and listening, instead of purely reacting. Move It or Lose It: Use physical activities to shift your child’s emotional state. Let the Clouds of Emotion Roll By: Guide your children when they are stuck on a negative emotion, and help them understand that feelings come and go. SIFT: Help children pay attention to the Sensations, Images, Feelings, and Thoughts within them so that they can make better decisions and be more flexible. Connect Through Conflict: Use discord to encourage empathy and greater social success.","2 years old, 3 years old, 4 years old, 5 years old, 6 years old, 7-12","Directive / Structured, Empathic / Supportive, Scientific / Research-based","everyday parenting scenarios where children experience big emotions, misbehavior or confusion.",,"Daniel J. Siegel, MD and Tina Payne Bryson, Phd","Dr Daniel Siegel is the executive director of the Mindsight Institute and founding co-director of the Mindful Awareness Research Center at UCLA, where he was also principal co-investigator of the Center for Culture, Brain and Development and Clinical Professor of Psychiatry at the School of Medicine.   Dr Tina Payne Bryson is a psychotherapist and the Founder/Executive Director of THE CENTER FOR CONNECTION"
4/30/2025 20:44:37,Book,The Yes Brain,https://drdansiegel.com/book/the-yes-brain/,"How to cultivate courage, curiosity and resilience in your child","When facing challenges, unpleasant tasks, and contentious issues such as homework, screen time, food choices, and bedtime, children often act out or shut down, responding with reactivity instead of receptivity. But our kids can be taught to approach life with openness and curiosity. Parents can foster their children’s ability to say yes to the world and welcome all that life has to offer, even during difficult times. This is what it means to cultivate a Yes Brain.
 ","Courage, curiosity and resilience","self motivation, courage, enthusiasm","build the four fundamentals of the Yes Brain—balance, resilience, insight, and empathy—and how to strengthen them, the key to knowing when kids need a gentle push out of a comfort zone vs. needing the “cushion” of safety and familiarity, strategies for navigating away from negative behavioral and emotional states (aggression and withdrawal) and expanding your child’s capacity for positivity",Any,"Playful / Connected, Directive / Structured, Empathic / Supportive, Reflective / Philosophical, Practical / Action-Oriented","When a child is anxious or fearful, they give up easily or resist trying new things. When  parents want to teach self regulation, empathy and independence, parents move away from controlling or reactive parenting.",,Daniel J. Siegel MD and Tina Payne Bryson Phd.,"A graduate of Harvard Medical School, Dan completed his postgraduate training at UCLA specializing in pediatrics, and adult, adolescent, and child psychiatry, Tina Payne Bryson Phd  is a psychotherapist and the Founder/Executive Director of THE CENTER FOR CONNECTION, her mental health clinic in Pasadena, California."
4/30/2025 22:20:40,Book,"The First Bite, How we learn how to eat",https://www.beewilson.com/book/first-bite,Insights on how food habits from early and how to shape healthy preferences. ,"The way we learn to eat holds the key to why food has gone so disastrously wrong for so many people. But Bee Wilson also shows that both adults and children have immense potential for learning new, healthy eating habits. An exploration of the extraordinary and surprising origins of our taste and eating habits, First Bite explains how we can change our palates to lead healthier, happier lives.",Picky Eating / Eating Habits,Picky Eating / Eating Habits,Children are not born picky. Taste is shaped by exposure and repetition. Offer new foods 10-15 times in low pressure setting.  Allow kids to decide how much to eat. Establish routine of meals and snacks. Let children listen to their body's hunger/fullness signals.,"2 years old, 3 years old, 4 years old, 5 years old, 6 years old, 0 - 7","Adaptive / Culturally Sensitive, Empathic / Supportive, modeling over mandating, routines and habits","when children refuse vegetables, new foods, or only eat safe foods.","Mealtime (e.g., breakfast, lunch, dinner)",Bee Wilson,"Beatrice Dorothy ""Bee"" Wilson FRSL is a British food writer and journalist. She writes the ""Table Talk"" column for The Wall Street Journal, and is also a campaigner for food education through the charity TastEd."
