4/30/2025 7:06:01,Website Article,harvard health publishing,https://www.health.harvard.edu/blog/study-gives-insight-and-advice-on-picky-eating-in-children-2020060920004,Study gives insight — and advice — on picky eating in children,"Much of picky eating may be related to negative thoughts and memories about certain foods, or eating in general. The more that you are upbeat and positive about eating, the more likely your child will be that way too. Here are some ideas on how to do that:

Have family meals — and enjoy each other during them. Eating together puts the emphasis on the social aspect of eating, rather than the food itself, which can be helpful. It's most helpful if that social aspect is pleasant, so put aside the devices and use mealtimes as time to catch up with each other, tell funny stories and otherwise enjoy the time together.
Don't force a child to eat. Encourage them to try new foods, but don't get into fights about it. And do not make them finish everything on their plate (the ""clean plate club"" my parents always encouraged us to be part of is not a good idea). The corollary to this, though, is that you should not let your child snack all day (or fill up on milk or juice); if possible, they should arrive at a meal hungry enough to want to eat.
Involve your child in meal planning and preparation. Look at recipes together; be willing to try new and different things. Take them shopping with you. If you have the ability to grow some foods or spices, have your child be involved in that, too.",Picky Eating / Eating Habits,"Picky Eating / Eating Habits, positive mealtime environment, autonomy in eating, food involvement","Make Mealtimes Positive  Eat together as a family and enjoy conversation without screens.  Don’t Force Eating  Encourage trying new foods, but avoid pressure or requiring a clean plate. Limit snacks to ensure hunger at meals.  Involve Children  Let kids help with meal planning, shopping, and simple cooking to build interest and ownership.","2 years old, 3 years old, 4 years old, 5 years old, Any","Playful / Connected, Empathic / Supportive",,,,
4/30/2025 7:19:15,Website Article,"Make Mealtimes Positive  Eat together as a family and enjoy conversation without screens.  Don’t Force Eating  Encourage trying new foods, but avoid pressure or requiring a clean plate. Limit snacks to ensure hunger at meals.  Involve Children  Let kids help with meal planning, shopping, and simple cooking to build interest and ownership.",https://www.pregnancybirthbaby.org.au/cultural-differences-when-raising-children,cultural differences when raising children,"Family
If you experience cultural conflict in your extended family, you and your partner should work as a team.

Once you and your partner agree on a parenting issue, discuss your decision with other family members, such as grandparents.

Family members often just want the best for you and your child. You can set boundaries to help you work together as a family to care for your child. Communicate with your partner and family by:

standing up for yourself while still respecting their beliefs and feelings
speaking calmly and firmly
providing constructive criticism but not placing blame
using calm, open body language
reminding them that you appreciate the good things they bring to the relationship
thanking them when they respect your boundaries",Cultural Expectations & Tradition,"Cultural Expectations & Tradition, parental alignment","Align as a Couple First  Discuss and agree on parenting decisions with your partner before involving others.  Communicate Boundaries Clearly  Share decisions with extended family calmly and respectfully.  Set clear, firm boundaries while showing appreciation for their support.  Use Respectful Communication  Speak without blame, using calm tone and open body language.  Acknowledge and thank family members when they respect your boundaries.",Any,Adaptive / Culturally Sensitive,,,,
4/30/2025 7:22:45,Website Article,lifeologie,https://wefixbrains.com/resources/peaceful-parenting-for-perfectionists,peaceful parenting for perfectionists,"Try these steps to help guide you into more peaceful parenting:

Acknowledge your anxiety and insecurities as a parent. Reflect on what those anxieties and insecurities may be calling out for you to acknowledge regarding your personal fears.
Ponder the things that you hold of value. How might you confuse those things with what makes you valuable?
Be kind to yourself, and keep working on connection. Teach these things to your children. Let them know that it’s okay to make mistakes, and tangibly express that you are their biggest cheerleader. Interestingly enough, part of that is by mirroring consistent encouragement to yourself.",Perfectionism,"Perfectionism, self awareness in parenting",Acknowledge Internal Challenges  Recognize and reflect on your own parenting-related anxieties and insecurities.  Understand how these may be tied to personal fears or unmet needs.  Clarify Personal Values  Distinguish between what you value and your self-worth.  Reflect on how these perceptions may influence your parenting approach.  Model Self-Compassion and Connection  Be kind to yourself and show consistent self-encouragement.  Normalize mistakes and express unconditional support to your children.  Teach emotional resilience by example.,Any,Reflective / Philosophical,,,,
4/30/2025 7:32:54,Website Article,the center for parenting education,https://centerforparentingeducation.org/library-of-articles/indulgence-values/shifting-children-greed-gratitude/,shifting your children from greed to gratitude,"What Can Parents Do?

There are many things you can consider doing so your children develop the skills and attitudes that will help them to avoid the pitfalls of being labeled “spoiled.” You can teach children important life skills that will set them on a course of appreciation, moderation, and responsibility.

Be the “Executive” in your Home

Set limits and say “no” when appropriate.

For example, “No, it doesn’t work for me to have Sarah sleep over tonight.”

Help them to delay gratification by not giving them everything they want.

For example, “No, we don’t have time to stop for ice cream tonight.”

Do not make things too easy for them by allowing them to tolerate frustration in appropriate doses.

For example, “I know that learning to tie your shoes is hard to do, but I also know you can do it. I can talk you through the steps as you try it one more time.”

Let them experience a moderate amount of disappointment and then teaching them how to deal with it.

For example, “It is disappointing that you weren’t invited to Billy’s party. Is there something else you want to plan for that night?”

Show them how to make amends when they have hurt someone.

For example, “You knocked down your brother’s tower that he worked all day to build. What can you do to help him feel better?”

Hold them accountable for their behavior.

For example, “Even though your teacher did not post the assignment on line, you are still responsible for finding out what your homework is.”",children personality,greedy children,"Set Clear Limits  Say “no” when necessary and appropriate, even if it's uncomfortable.  Help children understand boundaries through calm, consistent responses.  Promote Delayed Gratification  Avoid giving in to every request.  Teach that waiting or not getting what they want is a normal part of life.  Build Frustration Tolerance  Let children face manageable challenges instead of solving everything for them.  Offer support without removing the difficulty.  Normalize Disappointment  Allow children to experience and process disappointment.  Help them find alternative plans or coping strategies.  Encourage Making Amends  Guide children to take responsibility for their actions and repair harm when needed.  Foster Accountability  Hold children responsible for following through, even when others fall short.  Teach that their actions and responsibilities are their own.",Any,Directive / Structured,,,,
4/30/2025 7:40:56,Website Article,Child Mind Institute,https://childmind.org/article/how-to-handle-tantrums-and-meltdowns/,Implementing Functional Assessments to Manage Tantrums,"To effectively address your child’s tantrums, begin by conducting a functional assessment to identify specific triggers. Observe what occurs immediately before each outburst—common patterns may emerge, such as tantrums during transitions like bedtime or homework. Once triggers are identified, proactively adjust routines to mitigate them; for instance, incorporate enjoyable activities into bedtime routines or schedule breaks during homework to reduce frustration. During a tantrum, remain calm and avoid reinforcing the behavior with attention. Instead, focus on teaching your child appropriate emotional responses and coping strategies, such as deep breathing or counting to ten. Consistent responses and clear communication help children learn that tantrums are not effective means of achieving their desires.",Tantrums,"Emotional Regulation, Behavior Management",Conduct functional assessments to identify tantrum triggers; adjust routines to mitigate identified triggers; remain calm during tantrums; avoid reinforcing tantrum behavior; teach and reinforce appropriate emotional coping strategies.,"2 years old, 3 years old, 4 years old, 5 years old, 6 years old","Directive / Structured, Empathic / Supportive, Scientific / Research-based","This advice emphasizes a structured yet empathetic approach, suitable across various cultural contexts. It focuses on proactive identification of triggers and consistent, calm responses to teach children effective emotional regulation skills.",,,
4/30/2025 7:42:11,Website Article,raisingchildren.net.au,https://raisingchildren.net.au/preschoolers/health-daily-care/toileting/toilet-training-guide,toilet training : a practical guide,"
Children might be ready for toilet training if they have dry nappies for 2 or more hours, know about poos and wees, and can pull pants up and down.
Toilet training equipment includes a potty or small toilet seat and training pants or undies.
Try to start toilet training when there are no big changes coming up for your family.
Make going to the toilet part of your child’s routine. Remind your child to go, and praise your child for trying.
Toilet training can take days, months or weeks. Be patient and keep encouraging your child.",potty training,potty training,"Start When Ready – Look for signs like staying dry, showing interest, or following instructions.  Prepare Gently – Use potty words, let them watch you, and try training pants before fully switching.  Use the Right Tools – Choose a potty or toilet with a step stool and child seat.  Build a Routine – Encourage regular potty times (e.g., after meals, before bed).  Encourage, Don’t Pressure – Praise effort, stay calm during accidents, and avoid forcing.  Promote Independence – Dress them in easy-off clothes, and teach wiping and handwashing.  Stay Consistent Out & About – Bring spare clothes and inform other caregivers.",2 years old,Directive / Structured,,,,
4/30/2025 7:45:51,Website Article,Psychology Today,https://www.psychologytoday.com/us/blog/inviting-monkey-tea/202211/recovering-mom-guilt ,Breaking Free from Parental Guilt,"Parental guilt often stems from internalized expectations and the belief that one must be a perfect parent. To combat this, it’s essential to recognize and challenge the “should” statements that fuel guilt, such as “I should always be patient” or “I should never make mistakes.” Instead, practice self-compassion by acknowledging that parenting is inherently challenging and that mistakes are opportunities for growth. Focus on the present moment and the positive aspects of your parenting journey. By shifting your inner dialogue from self-criticism to self-acceptance, you model resilience and emotional health for your children.",Guilt,"Self-Compassion, Parental Expectations, Emotional Well-being",Identify and challenge unrealistic “should” statements; practice self-compassion; focus on present parenting moments; shift inner dialogue to self-acceptance.,Any,"Empathic / Supportive, Reflective / Philosophical, Practical / Action-Oriented",This advice is universally applicable and emphasizes self-compassion and mindfulness. It’s suitable across various cultural contexts and adaptable to individual family dynamics.,,,
4/30/2025 7:46:37,Website Article,better health,https://www.betterhealth.vic.gov.au/health/healthyliving/solutions-sleep-concerns-toddlers-1-3-years,Solutions to sleep concerns (12) – toddlers 1 to 3 years,"It can be difficult to know whether your toddler is experiencing a sleep or settling concern. If your toddler's sleeping patterns are not affecting you or your family and you have strategies that work, then you may not have a sleep concern.
Parents are encouraged to be responsive to the needs of their toddlers. Developing positive sleep environments and routines can also support your toddler to self-settle.
There are a few approaches you can try if you are concerned with your toddler’s sleeping, these include: parental presence, camping out, bedtime fading and responsive settling. It is important that the approach you choose is right for your family.
Once you notice your toddler attempting to climb out of their cot, it is time to move them to a bed. This is usually between 2 and 3½ years of age but can be as early as 18 months. It is important to make sure that your home is safe to reduce their risk of injury. ",Sleep,Sleep,"Assess if There's a Real Concern – If your child’s sleep isn’t disrupting family life and your current strategies work, there may be no need to change.  Create a Positive Sleep Environment – Use consistent bedtime routines and calm surroundings to support self-settling.  Try Evidence-Based Settling Techniques – Consider approaches like:  Parental presence  Camping out  Bedtime fading  Responsive settling  Choose the method that suits your child’s temperament and your family’s values.  Transition from Cot to Bed Safely – Move to a bed once your toddler starts climbing out of the cot (typically 18 months to 3½ years). – Ensure the home environment is child-safe to prevent injuries.","2 years old, 3 years old",supportive,,,,
4/30/2025 7:51:45,Website Article,Greater Good Science Center at UC Berkeley,https://greatergood.berkeley.edu/article/item/six_ways_to_deal_with_parental_burnout,Practicing the “STOP” Method to Manage Parental Stress,"Parental burnout can creep in when we neglect our own needs amidst the demands of caregiving. To counter this, the “STOP” method offers a quick, grounding technique: S—Stop what you’re doing; T—Take a deep breath, emphasizing a longer exhale; O—Observe your current thoughts and feelings without judgment; P—Proceed with intention towards the next right action. This practice helps in pausing the autopilot mode, allowing parents to respond rather than react to stressors. Incorporating such mindful breaks throughout the day can rejuvenate your mental state and enhance your connection with your children.",Stress & Burnout,"Mindfulness, Emotional Regulation, Self-Care",Implement the “STOP” mindfulness technique during stressful moments to regain composure and respond thoughtfully to parenting challenges.,Any,"Empathic / Supportive, Scientific / Research-based, Practical / Action-Oriented","This advice is grounded in mindfulness practices and is adaptable across various cultural contexts. It’s particularly beneficial for parents seeking quick, effective strategies to manage daily stress and prevent burnout.",,,
4/30/2025 7:58:47,Book,Self-Reg: How to Help Your Child (And You) Break the Stress Cycle and Successfully Engage with Life by Dr. Stuart Shanker ,https://www.amazon.com/Self-Reg-Child-Break-Stress-Successfully/dp/0143191570,Implementing the Five-Step Self-Reg Process to Manage Parental Stress and Burnout ,"In Self-Reg, Dr. Stuart Shanker emphasizes that many parental challenges, including burnout, stem from unrecognized and unmanaged stress. He introduces the concept of self-regulation, which involves identifying and reducing stressors across five domains: biological, emotional, cognitive, social, and prosocial. By understanding that behaviors often perceived as misbehavior are actually stress responses, parents can shift from a reactive to a reflective approach. This perspective encourages parents to first address their own stress levels, recognizing that self-care is not indulgent but essential. Implementing self-regulation strategies—such as ensuring adequate sleep, nutrition, and moments of calm—can help parents restore their energy and better support their children’s needs.

In Self-Reg, Dr. Stuart Shanker introduces a five-step process to help parents manage stress and prevent burnout:
	1.	Reframe the Behavior: Understand that challenging behaviors in both children and parents are often stress responses, not intentional misbehavior.
	2.	Recognize the Stressors: Identify stressors across five domains—biological, emotional, cognitive, social, and prosocial—that may be affecting you or your child.
	3.	Reduce the Stress: Develop strategies to minimize identified stressors, such as adjusting routines, creating calming environments, or setting realistic expectations.
	4.	Reflect: Enhance awareness of stress responses and their impact on behavior. Consider what strategies are effective and where adjustments are needed.
	5.	Restore Energy: Engage in activities that replenish your energy and promote well-being, such as adequate sleep, physical activity, or mindfulness practices.

By applying this process, parents can better manage their own stress, model effective self-regulation for their children, and create a more harmonious family environment.",Stress & Burnout,"Self-Regulation, Parental Stress Management, Emotional Awareness","Identify personal stressors across five domains; implement self-care routines to manage stress; reframe child behavior as stress responses; adopt reflective parenting practices. Implement the five-step Self-Reg process: Reframe behavior, recognize stressors across five domains, reduce identified stressors, reflect on stress responses, and restore energy through self-care practices.",Any,"Empathic / Supportive, Scientific / Research-based, Practical / Action-Oriented","Dr. Shanker’s approach is grounded in neuroscience and psychology, offering a compassionate framework that is adaptable across diverse cultural contexts. It is particularly beneficial for parents seeking to understand the underlying causes of burnout and aiming to foster a more harmonious family environment through self-awareness and stress management.",,,
4/30/2025 8:01:57,Website Article,PACER Center – National Family Advocacy Support and Training (FAST) Project,https://wifacets.org/wp-content/uploads/2022/01/FAST-Skills-for-Effective-Parent-Advocates-FINAL-without-notes-8-7-18.pdf ,Six Skills for Effective Parent Advocacy ,"Effective parent advocacy is grounded in six foundational skills that empower parents to support their children’s needs effectively. First, understanding your child’s disability or challenges allows you to identify appropriate services and set realistic expectations. Second, knowing the key players—such as educators, healthcare providers, and administrators—helps in building collaborative relationships. Third, being aware of your rights and responsibilities ensures informed decision-making and active participation in your child’s care. Fourth, staying well-organized by keeping thorough records and documentation facilitates clear communication and tracking progress. Fifth, employing clear and effective communication strategies, including active listening and respectful dialogue, fosters mutual understanding. Lastly, knowing how to resolve disagreements through both informal discussions and formal processes like mediation ensures that conflicts are addressed constructively. By cultivating these skills, parents can become confident advocates, ensuring their children receive the support and services they need.",Advocacy Skills,"Parent Advocacy, Special Education, Communication Strategies",Develop and apply the six key advocacy skills to effectively support and advocate for your child’s educational and developmental needs.,Any,"Empathic / Supportive, Scientific / Research-based, Practical / Action-Oriented",This guidance is grounded in research and emphasizes a balanced approach combining empathy with clear boundaries. It’s suitable across various cultural contexts and adaptable to individual family dynamics.,,,
4/30/2025 8:06:28,Website Article,Richmond Family Magazine,https://richmondfamilymagazine.com/parenting/tips/multicultural-families-parenting/ ,"In multicultural families, it’s essential to actively embrace and integrate the diverse cultural traditions each parent brings. Begin by openly discussing with your partner the customs and values each of you holds dear. For instance, if one parent values attending religious services while the other prefers personal spiritual practices, find a balance that respects both perspectives. Celebrate and support each other’s traditions, even if they differ from your own. This mutual respect fosters a harmonious environment for your children. Additionally, create new family traditions that blend elements from both cultures, such as combining holiday celebrations or incorporating diverse cuisines into family meals. Encourage your children to participate in these traditions and explain the significance behind each practice. This approach not only honors your family’s diverse heritage but also instills a sense of pride and understanding in your children.","In multicultural families, it’s essential to actively embrace and integrate the diverse cultural traditions each parent brings. Begin by openly discussing with your partner the customs and values each of you holds dear. For instance, if one parent values attending religious services while the other prefers personal spiritual practices, find a balance that respects both perspectives. Celebrate and support each other’s traditions, even if they differ from your own. This mutual respect fosters a harmonious environment for your children. Additionally, create new family traditions that blend elements from both cultures, such as combining holiday celebrations or incorporating diverse cuisines into family meals. Encourage your children to participate in these traditions and explain the significance behind each practice. This approach not only honors your family’s diverse heritage but also instills a sense of pride and understanding in your children.",Cultural Expectations & Tradition,"Multicultural Families, Family Traditions, Cultural Integration","Engage in open discussions with your partner about each other’s cultural traditions and values. Actively participate in and support each other’s customs. Create new, blended family traditions that honor both cultures, and involve your children in these practices to foster understanding and pride in their diverse heritage.",Any,"Adaptive / Culturally Sensitive, Empathic / Supportive, Practical / Action-Oriented","This advice is particularly beneficial for families navigating multiple cultural identities. It promotes inclusivity, mutual respect, and creativity, allowing children to develop a strong sense of self that encompasses all aspects of their heritage.",,,
4/30/2025 8:11:48,Website Article, Guelph Family Health Study,https://guelphfamilyhealthstudy.com/2020/07/20/tips-for-managing-childrens-screen-time/,Managing Children’s Screen Time Effectively,"Managing children’s screen time is crucial for their overall development and well-being. The Guelph Family Health Study recommends several strategies to help parents navigate this challenge. First, balance screen time with other activities; ensure that children engage in screen-free activities to promote a healthy lifestyle. Second, keep meals media-free to encourage meaningful conversations and improve dietary patterns. Third, model good behaviors by setting time aside every day to play with your family without screens nearby. Fourth, keep mobile devices and charging stations out of the bedroom to promote better sleep hygiene. Fifth, avoid using screens as a reward or punishment, as this can create unhealthy associations. Lastly, create opportunities for human connection by setting aside time for screen-free family activities. By implementing these strategies, parents can foster a balanced approach to screen time, promoting healthier habits and stronger family connections.",Screen Time Management,"Family Activities, Sleep Hygiene, Behavioral Modeling","Implement structured screen time routines by balancing screen use with other activities, keeping meals media-free, modeling appropriate behaviors, removing devices from bedrooms, avoiding screens as rewards or punishments, and promoting screen-free family interactions.",Any,"Empathic / Supportive, Scientific / Research-based, Practical / Action-Oriented","These strategies are adaptable across various cultural contexts and family structures. They emphasize the importance of creating a balanced environment that supports children’s physical health, emotional well-being, and family relationships.",,,
